{
  "$schema": "http://madewithloveinindia.org/schema.json",
  "type": "open source project",
  "name": "Messaging App - Flutter & Firebase",
  "tagline": "Messaging app build using Flutter and Firebase",
  "url": "https://github.com/AmanNegi/Messaging-App-Flutter-",
  "city": "Dehradun",
  "state": "uttarakhand"
}
