{
  "$schema": "http://madewithloveinindia.org/schema.json",
  "type": "company",
  "name": "D3V.STORE",
  "tagline": "Debug Your Wardrobe",
  "url": "https://d3v.store",
  "city": "Kanpur",
  "state": "Uttar Pradesh",
  "linkedin_page": "https://www.linkedin.com/company/d3v-store/",
  "founded": 2021,
  "logo": "https://d3v.store/wp-content/uploads/2024/04/cropped-White-Black-M-Letter-Design-Business-Identity-for-Digital-Design-Company-Logo.png"
}
