{
  "$schema": "https://madewithloveinindia.org/schema.json",
  "type": "other",
  "name": "Toolooza",
  "tagline": "Supercharge productivity with 100+ free tools",
  "url": "https://tooloza.com/",
  "logo": "https://tooloza.com/uploads/main/001344fdd72147bfed63a3d6b9c72a7c.png",
  "founded": 2025,
  "city": "Hyderabad",
  "state": "telangana"
}
