{
  "$schema": "https://madewithloveinindia.org/schema.json",
  "type": "other",
  "name": "Geek Circuit",
  "tagline": "Tech guides, tips, and tricks for devs!",
  "url": "https://www.geekcircuit.com/",
  "logo": "https://www.geekcircuit.com/wp-content/uploads/2025/04/logo_light.webp",
  "founded": 2024,
  "city": "Hyderabad",
  "state": "telangana"
}
