{
  "$schema": "http://madewithloveinindia.org/schema.json",
  "type": "open source project",
  "name": "asciinema Player for GitHub",
  "tagline": "Embed asciinema links in READMEs on GitHub",
  "url": "https://github.com/plibither8/asciinema-player-for-github",
  "city": "New Delhi",
  "state": "delhi"
}
