{
  "$schema": "http://madewithloveinindia.org/schema.json",
  "type": "company",
  "name": "Gyft & Co.",
  "logo": "https://storage.googleapis.com/gyft--app.appspot.com/Logo.png",
  "tagline": "Crafting memories with Love.",
  "url": "https://gyft.app",
  "founded": 2019,
  "city": "Hyderabad",
  "state": "telangana",
  "facebook": "teamgyft",
  "twitter": "gyft_co",
  "instagram": "gyft.co"
}
