{
  "$schema": "http://madewithloveinindia.org/schema.json",
  "type": "open source project",
  "name": "Crew Attendance",
  "tagline": "Mark attendance using real-time face recognition",
  "url": "https://github.com/CrewCodeAnku/crew-attendance-nextjs-python-flutter",
  "city": "Mohali",
  "state": "punjab"
}
