{
  "$schema": "http://madewithloveinindia.org/schema.json",
  "type": "open source project",
  "name": "Breast-Cancer-Detection-App",
  "tagline": "Classify images of breast cells into classes",
  "url": "https://github.com/Harirai/Breast-Cancer-Detection-App",
  "city": "Varanasi",
  "state": "uttar-pradesh"
}
