{
  "$schema": "http://madewithloveinindia.org/schema.json",
  "type": "open source project",
  "name": "Abdullah Amal Khan's Portfolio",
  "tagline": "Dynamic personal portfolio showcasing my skills",
  "url": "https://github.com/probablyabdullah/portfolio",
  "city": "Bangalore",
  "state": "karnataka"
}
